text,intent
hey do you provide a dedicated customer success manager!,Inquiry
quick question: can i set granular permissions for different roles,Inquiry
update: need some time to think it over thanks,Medium Intent
update: we're interested but timing is bad rn,Medium Intent
so what happens when we reach our api limit...,Inquiry
update: why am i getting error 403 on a public endpoint asap,Complaint
note: send over the order form please,High Intent
wanna test it out,Medium Intent
quick question: i have been waiting on hold for hours.,Complaint
"hi, can we finalize the agreement today thanks",High Intent
quick question: putting this on pause for a month please,Medium Intent
when is support available?,Inquiry
"champion left the company, deal on hold",Low Intent
my card was charged incorrectly,Complaint
quick question: the analytics dashboard is completely inaccurate thanks,Complaint
nah,Low Intent
need pricing but not urgent,Medium Intent
"hi, we are happy with our current setup asap",Low Intent
update: how long is the implementation timeline usually,Inquiry
"hello, looks decent but we aren't ready yet asap",Medium Intent
quick question: we selected you as our vendor thanks,High Intent
"hello, let's get started on onboarding!",High Intent
"checking options, not sure yet",Medium Intent
pre-sales ques: does this integrate natively with salesforce,Inquiry
quick question: what languages does the platform support.,Inquiry
"hello, we want to move forward with the enterprise plan please",High Intent
"hello, putting this on pause for a month asap",Medium Intent
update: why am i getting error 403 on a public endpoint,Complaint
pre-sales ques: what happens when we reach our api limit,Inquiry
fyi: checking with it for security clearance rn,Medium Intent
quick question: not a priority right now rn,Low Intent
"hi, waiting for budget approval!",Medium Intent
so send the msa for legal review asap asap,High Intent
quick question: can i set granular permissions for different roles rn,Inquiry
quick question: can we finalize the agreement today asap,High Intent
note: i have been waiting on hold for hours please,Complaint
hey we build this internally so no need rn,Low Intent
support ticket: the documentation is severely out of date and useless,Complaint
fyi: ready to sign off on the proposal...,High Intent
sync with client: still in the evaluation phase,Medium Intent
"hi, we went with another solution rn",Low Intent
"love the features, hate the UI, will consider",Medium Intent
need pricing and a demo immediately,High Intent
closed lost: we don't have the budget for this,Low Intent
"hi, wrong person, try someone else please",Low Intent
quick question: we are comparing you with a few others please,Medium Intent
putting this on pause for a month rn,Medium Intent
fyi: what happens when we reach our api limit,Inquiry
u guys have an api or what,Inquiry
fyi: we are too small to need this rn,Low Intent
so extremely slow loading times in the eu region!,Complaint
"hi, we're interested but timing is bad rn",Medium Intent
"demo was okay, we will think about it",Medium Intent
hey can you put me on an email cadence for updates?!,Medium Intent
quick question: the documentation is severely out of date and useless thanks,Complaint
"hello, we are too small to need this asap",Low Intent
note: let's get started on onboarding!,High Intent
pre-sales ques: is it possible to white-label the dashboard,Inquiry
note: we are comparing you with a few others rn,Medium Intent
need support to upgrade my plan to enterprise,High Intent
"hi, why am i getting error 403 on a public endpoint.",Complaint
quick question: do you offer 24/7 technical support asap,Inquiry
fyi: urgent need to implement this week...,High Intent
sync with client: we are comparing you with a few others,Medium Intent
"lead called in, we selected you as our vendor",High Intent
fyi: unsubscribe immediately please thanks,Low Intent
inbound lead looking for basic integration docs,Inquiry
note: ready to proceed with the purchase thanks,High Intent
fyi: the user interface is incredibly non-intuitive...,Complaint
fyi: let's touch base in a few weeks asap,Medium Intent
we are comparing you with a few others please,Medium Intent
"highly interested, send contract",High Intent
app kinda buggy but ok for now,Medium Intent
update: need licenses for my team immediately,High Intent
fyi: billing department messed up my invoice again please,Complaint
fyi: we're interested but timing is bad rn,Medium Intent
"lead called in, we want to move forward with the enterprise plan",High Intent
idk maybe later bro,Low Intent
"hi, what languages does the platform support.",Inquiry
so i have been waiting on hold for hours asap,Complaint
so not interested at all thanks,Low Intent
"lead unresponsive after 5 follow ups, closing out",Low Intent
quick question: can i set granular permissions for different roles...,Inquiry
your recent update deleted my saved filters.,Complaint
quick question: following up next quarter might be better rn,Medium Intent
sync with client: checking with it for security clearance,Medium Intent
so do you guys have a compliance page i can check asap,Inquiry
fyi: your sales rep was extremely rude on the phone!,Complaint
send over the order form.,High Intent
update: not interested at all...,Low Intent
fyi: still in the evaluation phase,Medium Intent
"hello, don't ever call this number again",Low Intent
I was interested until support was rude to me,Complaint
so don't ever call this number again...,Low Intent
Whatever.,Low Intent
hey we're interested but timing is bad...,Medium Intent
quick question: still in the evaluation phase rn,Medium Intent
update: still in the evaluation phase asap,Medium Intent
how exactly does the machine learning work asap,Inquiry
fyi: i need to present this to the board first asap,Medium Intent
hey following up next quarter might be better!,Medium Intent
hey your recent update deleted my saved filters,Complaint
don't ever call this number again please,Low Intent
update: checking with it for security clearance please,Medium Intent
update: let's touch base in a few weeks!,Medium Intent
pls send invoice rn,High Intent
"hi, not interested at all!",Low Intent
hey where do i wire the funds asap,High Intent
"hey wrong person, try someone else...",Low Intent
"hello, looks decent but we aren't ready yet",Medium Intent
"customer filed a feature request, not happy it's missing",Complaint
"hello, need licenses for my team immediately please",High Intent
price?,Inquiry
so don't ever call this number again,Low Intent
"lead called in, send over the order form",High Intent
fyi: where do i wire the funds.,High Intent
"lead called in, send the msa for legal review asap",High Intent
"hi, not a priority right now",Low Intent
note: your sales rep was extremely rude on the phone thanks,Complaint
update: can you put me on an email cadence for updates?,Medium Intent
quick question: we want to move forward with the enterprise plan asap,High Intent
note: we build this internally so no need rn,Low Intent
quick question: waiting for budget approval,Medium Intent
closed lost: not interested at all,Low Intent
"hi, send over the order form thanks",High Intent
how long is the implementation timeline usually asap,Inquiry
"hi, how exactly does the machine learning work...",Inquiry
client asked for pricing during call,High Intent
We are a 5 person team.,Inquiry
update: we want to move forward with the enterprise plan,High Intent
note: how long is the implementation timeline usually.,Inquiry
so do you guys have a compliance page i can check thanks,Inquiry
"hello, your recent update deleted my saved filters rn",Complaint
"hello, your sales rep was extremely rude on the phone please",Complaint
fyi: do you provide a dedicated customer success manager please,Inquiry
fyi: we build this internally so no need rn,Low Intent
update: do you guys have a compliance page i can check...,Inquiry
support ticket: your sales rep was extremely rude on the phone,Complaint
fyi: looks decent but we aren't ready yet,Medium Intent
note: your sales rep was extremely rude on the phone.,Complaint
"hello, need licenses for my team immediately...",High Intent
sync with client: waiting for budget approval,Medium Intent
"terrible experience with sales, but the product works so we'll buy",High Intent
help,Inquiry
note: why am i getting error 403 on a public endpoint!,Complaint
lead wants a demo but not sure yet,Medium Intent
can I get a recorded demo link?,Inquiry
we build this internally so no need...,Low Intent
so still in the evaluation phase rn,Medium Intent
so billing department messed up my invoice again,Complaint
"hi, we selected you as our vendor!",High Intent
need pricing and demo asap,High Intent
note: your recent update deleted my saved filters please,Complaint
so not a priority right now!,Low Intent
this software is literally garbage ngl,Complaint
"client experienced error during pilot, evaluating",Medium Intent
"hello, your recent update deleted my saved filters!",Complaint
fyi: we are happy with our current setup rn,Low Intent
note: let's get started on onboarding thanks,High Intent
update: what languages does the platform support please,Inquiry
i am just a student doing a project asap,Low Intent
so we're interested but timing is bad thanks,Medium Intent
quick question: we selected you as our vendor,High Intent
quick question: does this integrate natively with salesforce please,Inquiry
quick question: mobile application crashes every time i open it thanks,Complaint
note: urgent need to implement this week asap,High Intent
need to schedule a demo immediately,High Intent
hey do you guys have a compliance page i can check rn,Inquiry
"hi, following up next quarter might be better...",Medium Intent
note: how long is the implementation timeline usually...,Inquiry
support ticket: i have been waiting on hold for hours,Complaint
still in the evaluation phase asap,Medium Intent
dashboard is crashing,Complaint
fyi: let's touch base in a few weeks...,Medium Intent
note: we don't have the budget for this please,Low Intent
"hey wrong person, try someone else please",Low Intent
"hello, is it possible to white-label the dashboard rn",Inquiry
"hi, the analytics dashboard is completely inaccurate!",Complaint
quick question: need some time to think it over!,Medium Intent
note: i want a full refund for this month's downtime please,Complaint
too expensive for our small shop please,Low Intent
fyi: urgent need to implement this week thanks,High Intent
buy,High Intent
"password reset email never arrives, fix this",Complaint
we are happy with our current setup.,Low Intent
prcing plz,High Intent
lead requested demo for next tuesday,Medium Intent
"hey wrong person, try someone else!",Low Intent
hey we are comparing you with a few others...,Medium Intent
login not working again,Complaint
so the documentation is severely out of date and useless!,Complaint
send the msa for legal review asap thanks,High Intent
quick question: does this integrate natively with salesforce!,Inquiry
fyi: do you provide a dedicated customer success manager asap,Inquiry
support was helpful but we chose another tool,Low Intent
pricing details please,High Intent
pre-sales ques: what languages does the platform support,Inquiry
"hello, we build this internally so no need...",Low Intent
"hi, we are happy with our current setup!",Low Intent
note: too expensive for our small shop please,Low Intent
hey is it possible to white-label the dashboard,Inquiry
"lead called in, process payment for the annual tier",High Intent
is there a known error with active directory sync?,Inquiry
"hello, do you provide a dedicated customer success manager!",Inquiry
note: we want to move forward with the enterprise plan rn,High Intent
where is the billing portal?,Inquiry
where do i wire the funds please,High Intent
update: can you put me on an email cadence for updates? please,Medium Intent
"hello, not interested at all!",Low Intent
how do I report a non-critical bug?,Inquiry
"hello, how long is the implementation timeline usually...",Inquiry
update: we went with another solution thanks,Low Intent
fyi: where do i wire the funds!,High Intent
hey is it possible to white-label the dashboard...,Inquiry
update: we don't have the budget for this,Low Intent
quick question: extremely slow loading times in the eu region asap,Complaint
note: the user interface is incredibly non-intuitive asap,Complaint
note: need to discuss internally with stakeholders thanks,Medium Intent
note: putting this on pause for a month thanks,Medium Intent
we are too small to need this please,Low Intent
quick question: do you offer 24/7 technical support,Inquiry
update: we want to move forward with the enterprise plan asap,High Intent
"POC successful, procurement is reviewing MSA",High Intent
looks decent but we aren't ready yet asap,Medium Intent
"not sure yet, need to think",Medium Intent
what are the rate limits on the API?,Inquiry
fyi: need to discuss internally with stakeholders!,Medium Intent
note: does this integrate natively with salesforce!,Inquiry
so we selected you as our vendor,High Intent
quick question: too expensive for our small shop!,Low Intent
quick question: where do i wire the funds,High Intent
pre-sales ques: how exactly does the machine learning work,Inquiry
hey the documentation is severely out of date and useless.,Complaint
sync with client: can you put me on an email cadence for updates?,Medium Intent
"hi, we are too small to need this!",Low Intent
note: do you provide a dedicated customer success manager thanks,Inquiry
what is your pricing model?,Inquiry
fyi: can we export data as a csv or json,Inquiry
note: does this integrate natively with salesforce,Inquiry
fyi: don't ever call this number again rn,Low Intent
"hello, still in the evaluation phase.",Medium Intent
note: need some time to think it over...,Medium Intent
update: why am i getting error 403 on a public endpoint!,Complaint
dmeo,Inquiry
hey is there a limit to how many users we can add,Inquiry
update: what happens when we reach our api limit!,Inquiry
fyi: not interested at all.,Low Intent
so does this integrate natively with salesforce.,Inquiry
"hi, looks decent but we aren't ready yet rn",Medium Intent
note: let's touch base in a few weeks!,Medium Intent
so let's kick off the project!,High Intent
so need licenses for my team immediately!,High Intent
support ticket: the user interface is incredibly non-intuitive,Complaint
so the documentation is severely out of date and useless...,Complaint
"hi, we want to move forward with the enterprise plan...",High Intent
update: don't ever call this number again asap,Low Intent
so not interested at all,Low Intent
support ticket: i want a full refund for this month's downtime,Complaint
so lost all my work because the auto-save failed rn,Complaint
your sales rep was extremely rude on the phone rn,Complaint
note: we selected you as our vendor!,High Intent
"this bug is unacceptable, cancelling my account",Complaint
"hi, let's kick off the project",High Intent
"closed lost: wrong person, try someone else",Low Intent
quick question: the analytics dashboard is completely inaccurate asap,Complaint
interested but budget is an issue,Medium Intent
hey why am i getting error 403 on a public endpoint rn,Complaint
fyi: do you provide a dedicated customer success manager rn,Inquiry
hey your sales rep was extremely rude on the phone,Complaint
fyi: i am just a student doing a project.,Low Intent
hey we are comparing you with a few others,Medium Intent
update: i am just a student doing a project.,Low Intent
process payment for the annual tier rn,High Intent
quick question: we selected you as our vendor asap,High Intent
hey do you guys have a compliance page i can check...,Inquiry
so ready to proceed with the purchase asap,High Intent
send over the order form asap,High Intent
"customer furious about ongoing downtime, churn risk",Complaint
"hi, not a priority right now...",Low Intent
"hello, let's touch base in a few weeks rn",Medium Intent
update: let's touch base in a few weeks...,Medium Intent
found a bug but I still want to buy,High Intent
so mobile application crashes every time i open it thanks,Complaint
hey putting this on pause for a month!,Medium Intent
note: we are happy with our current setup!,Low Intent
sync with client: let's touch base in a few weeks,Medium Intent
fyi: we want to move forward with the enterprise plan,High Intent
quick question: do you guys have a compliance page i can check rn,Inquiry
hey mobile application crashes every time i open it asap,Complaint
update: lost all my work because the auto-save failed.,Complaint
"API keeps aggressively rate limiting me, dropping requests",Complaint
fyi: we selected you as our vendor.,High Intent
quick question: billing department messed up my invoice again,Complaint
so don't ever call this number again please,Low Intent
hey please remove me from your list...,Low Intent
your sales rep was extremely rude on the phone please,Complaint
pricing is way beyond our budget right now,Low Intent
"looks amazing, no budget till 2025",Medium Intent
"hi, we are too small to need this please",Low Intent
note: how exactly does the machine learning work please,Inquiry
hey do you offer 24/7 technical support rn,Inquiry
how long is the typical demo?,Inquiry
let's talk next week,Medium Intent
closed lost: i am just a student doing a project,Low Intent
note: your recent update deleted my saved filters...,Complaint
just checking pricing not buying yet,Inquiry
hey i am just a student doing a project thanks,Low Intent
"hello, too expensive for our small shop rn",Low Intent
"hi, how exactly does the machine learning work thanks",Inquiry
quick question: the user interface is incredibly non-intuitive...,Complaint
"hi, do you provide a dedicated customer success manager please",Inquiry
update: we are too small to need this...,Low Intent
"hello, need to discuss internally with stakeholders",Medium Intent
not interested at all,Low Intent
"hi, is there a limit to how many users we can add thanks",Inquiry
note: i need to present this to the board first asap,Medium Intent
lead discussing internally with finance,Medium Intent
"hi, checking with it for security clearance asap",Medium Intent
this looks good but maybe later,Medium Intent
quick question: let's get started on onboarding thanks,High Intent
looks decent but we aren't ready yet...,Medium Intent
sync with client: we're interested but timing is bad,Medium Intent
update: send over the order form asap,High Intent
fyi: billing department messed up my invoice again,Complaint
"hello, i have been waiting on hold for hours rn",Complaint
we want to move forward with the enterprise plan,High Intent
update: i have been waiting on hold for hours asap,Complaint
not interested at all thanks,Low Intent
closed lost: we went with another solution,Low Intent
hey your recent update deleted my saved filters rn,Complaint
client said maybe later,Medium Intent
quick question: the analytics dashboard is completely inaccurate rn,Complaint
hey where do i wire the funds!,High Intent
quick question: not a priority right now thanks,Low Intent
"hi, ready to proceed with the purchase please",High Intent
we are happy with our current setup,Low Intent
"hi, let's get started on onboarding rn",High Intent
"hello, unsubscribe immediately please rn",Low Intent
update: we selected you as our vendor rn,High Intent
note: unsubscribe immediately please please,Low Intent
your sales rep was extremely rude on the phone.,Complaint
update: checking with it for security clearance thanks,Medium Intent
we are too small to need this thanks,Low Intent
note: what happens when we reach our api limit rn,Inquiry
Send it over.,High Intent
so why am i getting error 403 on a public endpoint...,Complaint
broken,Complaint
closed lost: unsubscribe immediately please,Low Intent
closed lost: we build this internally so no need,Low Intent
"hello, urgent need to implement this week asap",High Intent
"hello, do you offer 24/7 technical support.",Inquiry
update: what languages does the platform support thanks,Inquiry
"lead called in, where do i wire the funds",High Intent
"hi, putting this on pause for a month rn",Medium Intent
hey we don't have the budget for this please,Low Intent
"hi, is it possible to white-label the dashboard!",Inquiry
can i set granular permissions for different roles!,Inquiry
"hello, is there a limit to how many users we can add please",Inquiry
send over the pricing tier list,Medium Intent
hey how exactly does the machine learning work!,Inquiry
need demo but not urgent,Medium Intent
hey ready to sign off on the proposal please,High Intent
quick question: we're interested but timing is bad.,Medium Intent
note: not a priority right now.,Low Intent
"hello, is it possible to white-label the dashboard!",Inquiry
"wrong person, referred me to the CTO",Low Intent
update: we selected you as our vendor please,High Intent
so is it possible to white-label the dashboard!,Inquiry
quick question: what languages does the platform support please,Inquiry
hey what happens when we reach our api limit asap,Inquiry
quick question: let's touch base in a few weeks...,Medium Intent
note: extremely slow loading times in the eu region!,Complaint
"hello, wrong person, try someone else...",Low Intent
note: ready to sign off on the proposal rn,High Intent
"hi, let's touch base in a few weeks rn",Medium Intent
"hello, the analytics dashboard is completely inaccurate thanks",Complaint
we don't have the budget for this rn,Low Intent
fyi: your recent update deleted my saved filters asap,Complaint
pricing is high so probably not,Low Intent
fyi: do you provide a dedicated customer success manager.,Inquiry
"update: wrong person, try someone else",Low Intent
so let's get started on onboarding please,High Intent
fyi: why am i getting error 403 on a public endpoint!,Complaint
fyi: your recent update deleted my saved filters please,Complaint
note: need licenses for my team immediately please,High Intent
update: the user interface is incredibly non-intuitive rn,Complaint
fyi: i have been waiting on hold for hours,Complaint
send the msa for legal review asap please,High Intent
"hi, can we export data as a csv or json rn",Inquiry
"hi, we went with another solution.",Low Intent
fyi: we went with another solution.,Low Intent
hey do you guys have a compliance page i can check.,Inquiry
send the msa for legal review asap...,High Intent
hey extremely slow loading times in the eu region.,Complaint
My boss told me to look at this.,Inquiry
update: where do i wire the funds rn,High Intent
hey checking with it for security clearance asap,Medium Intent
so do you guys have a compliance page i can check.,Inquiry
"hi, how long is the implementation timeline usually thanks",Inquiry
We use Excel.,Low Intent
"hello, not a priority right now please",Low Intent
fyi: please remove me from your list...,Low Intent
"hi, waiting for budget approval rn",Medium Intent
fyi: let's touch base in a few weeks!,Medium Intent
so we're interested but timing is bad rn,Medium Intent
note: what happens when we reach our api limit,Inquiry
quick question: can we finalize the agreement today rn,High Intent
fyi: ready to proceed with the purchase.,High Intent
"hi, waiting for budget approval.",Medium Intent
update: we went with another solution.,Low Intent
fyi: need to discuss internally with stakeholders.,Medium Intent
sync with client: looks decent but we aren't ready yet,Medium Intent
"hello, do you guys have a compliance page i can check asap",Inquiry
fyi: billing department messed up my invoice again.,Complaint
note: how exactly does the machine learning work.,Inquiry
fyi: why am i getting error 403 on a public endpoint thanks,Complaint
note: can i set granular permissions for different roles,Inquiry
update: send over the order form rn,High Intent
note: what languages does the platform support...,Inquiry
hey is there a limit to how many users we can add...,Inquiry
"hi, what languages does the platform support!",Inquiry
note: we are comparing you with a few others!,Medium Intent
"hi, wrong person, try someone else rn",Low Intent
"spoke with VP, they are evaluating 3 vendors including us",Medium Intent
waiting for budget approval please,Medium Intent
"hi, send over the order form please",High Intent
so lost all my work because the auto-save failed asap,Complaint
update: does this integrate natively with salesforce!,Inquiry
hey the user interface is incredibly non-intuitive asap,Complaint
"hi, extremely slow loading times in the eu region thanks",Complaint
so do you provide a dedicated customer success manager asap,Inquiry
I guess it's fine.,Medium Intent
"hello, how long is the implementation timeline usually asap",Inquiry
unsubscribe immediately please rn,Low Intent
closed lost: too expensive for our small shop,Low Intent
"hi, i need to present this to the board first rn",Medium Intent
"hi, following up next quarter might be better thanks",Medium Intent
fyi: the user interface is incredibly non-intuitive please,Complaint
quick question: how long is the implementation timeline usually rn,Inquiry
fyi: let's kick off the project,High Intent
so we want to move forward with the enterprise plan please,High Intent
pre-sales ques: can i set granular permissions for different roles,Inquiry
so i want a full refund for this month's downtime...,Complaint
update: the user interface is incredibly non-intuitive,Complaint
"hi, please remove me from your list rn",Low Intent
"hey wrong person, try someone else.",Low Intent
need licenses for my team immediately please,High Intent
can we finalize the agreement today asap,High Intent
"hello, we are comparing you with a few others!",Medium Intent
note: we went with another solution,Low Intent
fyi: can we export data as a csv or json.,Inquiry
update: send the msa for legal review asap thanks,High Intent
fyi: not interested at all!,Low Intent
update: urgent need to implement this week asap,High Intent
