text,intent
note: can we export data as a csv or json thanks,Inquiry
update: ready to proceed with the purchase please,High Intent
note: don't ever call this number again.,Low Intent
fyi: looks decent but we aren't ready yet thanks,Medium Intent
"hello, can you put me on an email cadence for updates? asap",Medium Intent
"hi, need licenses for my team immediately!",High Intent
quick question: send the msa for legal review asap please,High Intent
quick question: extremely slow loading times in the eu region please,Complaint
so i need to present this to the board first rn,Medium Intent
update: we went with another solution asap,Low Intent
quick question: too expensive for our small shop rn,Low Intent
putting this on pause for a month please,Medium Intent
sync with client: putting this on pause for a month,Medium Intent
so your recent update deleted my saved filters,Complaint
hey not interested at all asap,Low Intent
so where do i wire the funds,High Intent
support ticket: extremely slow loading times in the eu region,Complaint
what languages does the platform support...,Inquiry
"hello, we are comparing you with a few others asap",Medium Intent
note: why am i getting error 403 on a public endpoint,Complaint
"too expensive, unless you can do 50% off?",Medium Intent
I'm leaving.,Low Intent
note: your recent update deleted my saved filters asap,Complaint
"hello, i have been waiting on hold for hours",Complaint
hey we selected you as our vendor please,High Intent
fyi: can i set granular permissions for different roles thanks,Inquiry
verbal commitment secured on the call today,High Intent
"I don't get how this works, but my boss wants me to buy it",High Intent
quick question: we selected you as our vendor...,High Intent
"met at conference, mild interest, add to nurture sequence",Medium Intent
hey following up next quarter might be better.,Medium Intent
dashboard keeps crashing when I export,Complaint
hey need to discuss internally with stakeholders.,Medium Intent
fyi: let's get started on onboarding thanks,High Intent
note: unsubscribe immediately please thanks,Low Intent
quick question: let's kick off the project...,High Intent
your demo environment kept crashing,Complaint
system is slow but we still like it,Medium Intent
are other companies in our industry interested in this?,Inquiry
"hi, we want to move forward with the enterprise plan please",High Intent
note: we selected you as our vendor thanks,High Intent
"hello, waiting for budget approval please",Medium Intent
"lead called in, need licenses for my team immediately",High Intent
so the user interface is incredibly non-intuitive.,Complaint
"lead called in, can we finalize the agreement today",High Intent
still in the evaluation phase.,Medium Intent
"lead called in, let's get started on onboarding",High Intent
I saw your ad.,Low Intent
customer rejected proposal due to cost,Low Intent
following up next quarter might be better asap,Medium Intent
hey i have been waiting on hold for hours asap,Complaint
update: not interested at all rn,Low Intent
"hello, billing department messed up my invoice again.",Complaint
note: we want to move forward with the enterprise plan!,High Intent
"hello, is it possible to white-label the dashboard please",Inquiry
your sales rep was extremely rude on the phone,Complaint
it's exactly what we need but we just signed with a competitor,Low Intent
so i have been waiting on hold for hours!,Complaint
"hi, extremely slow loading times in the eu region please",Complaint
so i need to present this to the board first please,Medium Intent
note: is it possible to white-label the dashboard rn,Inquiry
update: what happens when we reach our api limit...,Inquiry
update: your recent update deleted my saved filters,Complaint
quick question: need some time to think it over asap,Medium Intent
pricing on the website is completely wrong and confusing,Complaint
the user interface is incredibly non-intuitive...,Complaint
Is there a way to do the thing with the stuff?,Inquiry
"hi, how exactly does the machine learning work please",Inquiry
quick question: why am i getting error 403 on a public endpoint please,Complaint
"maybe later, not convinced",Medium Intent
support ignored my ticket for 3 days,Complaint
"hi, send over the order form",High Intent
"hello, let's kick off the project asap",High Intent
client mentioned interest but no budget currently,Medium Intent
note: extremely slow loading times in the eu region rn,Complaint
so we're interested but timing is bad.,Medium Intent
"hi, the documentation is severely out of date and useless",Complaint
so we don't have the budget for this,Low Intent
update: checking with it for security clearance...,Medium Intent
quick question: do you guys have a compliance page i can check asap,Inquiry
quick question: is there a limit to how many users we can add!,Inquiry
quick question: mobile application crashes every time i open it,Complaint
we want to move forward with the enterprise plan.,High Intent
client just wants to know if we have a mobile app,Inquiry
update: do you offer 24/7 technical support.,Inquiry
"hi, we selected you as our vendor rn",High Intent
closed lost: we are too small to need this,Low Intent
so i have been waiting on hold for hours please,Complaint
"sent contract via docusign, waiting for signature",High Intent
demo looked cool but we don't have the budget,Low Intent
hey we selected you as our vendor asap,High Intent
we need this yesterday but legal is blocking,Medium Intent
"hi, lost all my work because the auto-save failed asap",Complaint
hey we don't have the budget for this rn,Low Intent
update: ready to proceed with the purchase,High Intent
hey waiting for budget approval asap,Medium Intent
user reported login issue during demo,Complaint
"hi, we went with another solution!",Low Intent
note: looks decent but we aren't ready yet,Medium Intent
update: putting this on pause for a month asap,Medium Intent
quick question: what languages does the platform support!,Inquiry
do you offer 24/7 technical support...,Inquiry
pre-sales ques: is there a limit to how many users we can add,Inquiry
so i need to present this to the board first...,Medium Intent
update: we're interested but timing is bad.,Medium Intent
hey send the msa for legal review asap asap,High Intent
quick question: i have been waiting on hold for hours!,Complaint
hey can we export data as a csv or json thanks,Inquiry
note: what languages does the platform support please,Inquiry
Make it work.,Complaint
quick question: don't ever call this number again!,Low Intent
pricing seems too high not interested,Low Intent
"lead called in, ready to proceed with the purchase",High Intent
fyi: mobile application crashes every time i open it!,Complaint
when u drop the new update hit me up,Medium Intent
so checking with it for security clearance,Medium Intent
waiting on support resolution before making a decision,Medium Intent
quick question: i have been waiting on hold for hours thanks,Complaint
"hello, what happens when we reach our api limit please",Inquiry
fyi: what happens when we reach our api limit rn,Inquiry
note: don't ever call this number again rn,Low Intent
can I reset my password?,Inquiry
"note: wrong person, try someone else...",Low Intent
"hello, billing department messed up my invoice again please",Complaint
update: too expensive for our small shop.,Low Intent
quick question: looks decent but we aren't ready yet rn,Medium Intent
not ready for a demo yet,Low Intent
so we don't have the budget for this thanks,Low Intent
update: don't ever call this number again...,Low Intent
update: we are comparing you with a few others...,Medium Intent
update: urgent need to implement this week!,High Intent
pre-sales ques: how long is the implementation timeline usually,Inquiry
note: do you guys have a compliance page i can check asap,Inquiry
support ticket: billing department messed up my invoice again,Complaint
why am i getting error 403 on a public endpoint,Complaint
update: we're interested but timing is bad!,Medium Intent
quick question: billing department messed up my invoice again thanks,Complaint
so lost all my work because the auto-save failed!,Complaint
note: ready to sign off on the proposal...,High Intent
is there a limit to how many users we can add,Inquiry
update: your sales rep was extremely rude on the phone.,Complaint
"budget approved for Q3, follow up in August",Medium Intent
fyi: what happens when we reach our api limit please,Inquiry
fyi: i have been waiting on hold for hours please,Complaint
fyi: checking with it for security clearance please,Medium Intent
"not interested, heard your app has too many bugs",Low Intent
"hi, we are too small to need this...",Low Intent
do you guys have a compliance page i can check.,Inquiry
so ready to proceed with the purchase.,High Intent
note: let's touch base in a few weeks.,Medium Intent
fyi: let's get started on onboarding,High Intent
so please remove me from your list asap,Low Intent
update: does this integrate natively with salesforce rn,Inquiry
"hi, your recent update deleted my saved filters please",Complaint
quick question: unsubscribe immediately please...,Low Intent
"hi, we build this internally so no need please",Low Intent
hey ready to sign off on the proposal...,High Intent
Not sure why I'm getting these emails.,Low Intent
we don't have the budget for this!,Low Intent
how to fix login issue?,Inquiry
what happens when we reach our api limit rn,Inquiry
note: not interested at all asap,Low Intent
so waiting for budget approval please,Medium Intent
fyi: how exactly does the machine learning work,Inquiry
fyi: send over the order form please,High Intent
support ticket: your recent update deleted my saved filters,Complaint
"getting an error 500 on checkout, fix it so I can pay",High Intent
yo can u share pricing rn,High Intent
Do better.,Complaint
"hi, looks decent but we aren't ready yet!",Medium Intent
so how exactly does the machine learning work...,Inquiry
Can we talk?,Inquiry
